student,structure,effort,evaluation,tokens,pos,neut,neg,sentiment
1,"이론 설명이 주가 된다. 하지만, 이론 설명만으로는 한 나라의 문화를 모두 이해하는데 어려움이 있을 수 있으므로 이해를 돕기 위해 첨부해주신 PPT의 사진들, 유튜브의 동영상들을 시청하도록 되어있다. 영화의 경우 저작권 문제 때문에 각자 보는 것으로 하고, 대신 시험범위에서는 제외해주신다. 수업 진행의 경우 본격적으로 프랑스의 문화를 살펴보기 전 프랑스, 프랑스인에 대한 전반적인 설명과 긴 프랑스의 역사에 대한 설명을 다루면서 추후에 다룰 여러 프랑스 문화에 대한 이해가 쉽도록 진행하신다. 시험의 경우 중간고사, 기말고사로 총 2번을 치고 따로 다른 과제 같은 것은 없다. 원래는 각각 45%, 45%인데 이번에는 코로나19로 인해 중간 30%, 기말 60%, 출석 10%로 진행되었다.","매 수업 전 예습을 해서 오늘 배울 내용이 무엇인지를 먼저 파악했고, 수업이 끝난 후에는 그 내용을 이해하려고 노력했다. 이해되지 않는 부분은 이메일로 질문을 드려 끝까지 이해하기 위해 노력했으며 복습 또한 꾸준히 했다.","프랑스문화권연구 과목을 처음 들어봐서 기존의 대면 수업의 경우 어떤 방식으로 했는지는 정확히는 잘 모르겠지만, 이후에 대면 수업을 할 때도 중간 중간 첨부된 사진과 영상을 참고하면 프랑스 문화에 대한 이해가 수월할 것 같다. 그리고 수업 중간에 수업 내용과 관련해서 들려주시는 교수님의 프랑스 유학시절 이야기도 수업 내용을 오래 기억에 남게 하는 것 같다. 굳이 zoom과 같은 화상 강의를 하지 않아도 충분히 내용을 이해할 수 있도록 보조 자료와 함께 잘 설명해주시는 것 같아서 좋은 것 같다. 수업시간에 배운 내용을 현실에 직접 적용해보거나 책, 영상 등을 통해 더욱 깊이 알아보는 등의 적극적인 학업 태도를 가질 수 있도록 이 과목이 좋은 영향을 준 것 같다.","['프랑스', '문화', '연구', '과목', '처음', '봐서', '기존', '대면', '어떤', '방식', '했는지는', '정확히는', '잘', '모르겠지만', '대면', '중간', '중간', '첨부', '사진', '영상', '참고', '하면', '프랑스', '문화', '이해', '수월할', '중간', '들려주시는', '프랑스', '유학', '시절', '이야기', '오래', '기억', '남게', '굳이', '같은', '화상', '하지', '않아도', '충분히', '이해', '있도록', '보조', '자료', '함께', '잘', '설명', '해주시는', '같아서', '좋은', '시간', '배운', '현실', '직접', '적용', '해보거나', '책', '영상', '더욱', '깊이', '알아보는', '적극', '학업', '태도', '가질', '있도록', '과목', '좋은', '영향', '준']",0.6285011406578946,0.06225660302631579,0.27901203326315793,positive
2,"교수님께서 해당 주차에 들어야 할 강의를 월요일, 수요일 강의로 나누어 차례로 스노우보드에 업로드 해주셨다. 같이 봐야할 수업 ppt파일도 올려주셨다. 
수업 내용에 대한 질문이 생기면 강좌 큐앤에이 게시판에 들어가 질문 글을 남기면 빠르게 대답해주셨다. 
다른 사람들이 남긴 질문도 볼 수 있어 유익했다. 시험은 대형강의이다 보니 온라인으로 보게 됐지만, 
문제 수와 시간이 적절했다.",수업을 제때제때 듣고 수업 자료에 필기를 했다. 수업에 관해 궁금한 것이 생기면 교수님께 질문을 했다. 헷갈리거나 여러 번 나오는 이름들을 따로 정리해 구별해 기억해내려고 노력했다. 내용과 명칭 등에 익숙해지기 위해서 한 번에 외우려고 하기보다는 여러 번 읽었다.,"온라인 강의를 통해 전에 들었던 강의를 다시 들을 수 있다는 것은 좋았다. 하지만 아무래도 현장 강의에서 몰입하는 편이 더 좋을 것 같다. 현장 강의에서 생각해 볼 문제에 관해서 같이 수업 듣는 학생들끼리 이야기를 나누어 봐도 좋을 것 같다는 생각이 들었다. 교수님께 온라인으로 질문하는 것도 좋았다. 평소에 이런 걸 물어봐도 되나 싶은 걸 머뭇거리지 않고 여쭤볼 수 있고 교수님도 그 질문을 이해하고 확실하지 않은 부분을 더 자세히 설명해주실 수 있을 것 같아서 좋았다. 대학 수업을 처음 들어보는 거라서 긴장도 되고 어렵지 않을까라는 생각이 들었지만, 교수님께서 차근차근 재밌게 설명해주셔서 전체적으로 재밌게 수업을 들을 수 있었다. 수업에 대해서 어렵게 생각하지 않고 알려주시는 내용을 차근차근 익혀나가면 어떤 수업이라도 들을 수 있을 것이라는 자신감이 생겼다. 꾸준히 복습하고 여러 번 내용을 보면 확실히 머릿속에 내용이 더 잘 들어와서 복습의 중요성을 깨달은 것 같다. ","['온라인', '들었던', '다시', '들을', '있다는', '좋았다', '아무래도', '현장', '몰입', '편이', '좋을', '현장', '생각', '문제', '관해', '같이', '듣는', '끼리', '이야기', '나누어', '봐도', '좋을', '같다는', '생각', '들었다', '온라인', '질문', '좋았다', '평소', '이런', '걸', '물어봐도', '되나', '싶은', '걸', '머뭇거리지', '않고', '여쭤', '있고', '질문', '이해', '확실하지', '않은', '부분', '자세히', '설명', '해주실', '있을', '같아서', '좋았다', '대학', '처음', '보는', '거', '긴장도', '되고', '어렵지', '않을까', '생각', '들었지만', '차근차근', '재밌게', '설명', '해주셔서', '전체', '재밌게', '들을', '있었다', '대해', '어렵게', '생각', '하지', '않고', '알려주시는', '차근차근', '익혀', '나가면', '어떤', '들을', '있을', '자신감', '생겼다', '복습', '여러', '확실히', '머릿속', '잘', '들어와서', '복습', '중요성', '깨달']",0.4198994581458333,0.12059676433333334,0.35275202227083335,positive
3,"이론 강의였으므로 수업 전체는 온라인으로 진행되었고, 1주일에 영상과 참고 자료가 2회 게시되었습니다. 
영상에서 참고 영상 등과 함께 교수님의 이론 설명이 진행되고, 참고 자료에 필기를 하며 수업을 듣는 형태였습니다.  각 시험은 모두 스노우보드의 퀴즈 게시판을 활용하여 진행되었으며, 오픈북으로 보되 암기 및 학습을 지향하고자 제한된 시간 안에 다수의 문제를 푸는 형태로 진행되었습니다. 중간고사에는 단답형 25문제를 20분간, 기말고사에는 단답형 35문제와 서술형 1문제를 40분간 풀이하는 형태였고 시험 전체의 범위와 함께 서술형 문제의 범위가 시험 전 공지사항에 게시되었습니다.","도움이 되었던 수업 방법은 직접 자료를 프린트해 필기를 하는 방식이었는데, 단순히 영상을 듣고 있는 것보다 훨씬 이해가 쉬웠을 뿐더러 나중에 한 번 더 정리를 하게 되어 학습에 더 큰 도움이 되었기 때문입니다. 
우선 최대한 빨리 수업을 듣고자 했습니다. 아무래도 온라인으로 수업이 진행되다 보니 시간이 지난 후에도 게시된 영상을 확인할 수 있고, 그렇기 때문에 마음이 느슨해져 영상 여러 개를 시험 전에 몰아 보게 되는 일이 생길 것이라 걱정했습니다. 따라서 영상이 게시된 후 최대한 빨리 수업을 듣고자 노력했습니다. 또 영상을 보면서 제대로 필기하고자 했습니다. 과제 없이 두 번의 시험으로만 성적이 결정되므로, 시험 때 최선을 다하기 위해서는 미리 조금씩 준비해 두는 것이 가장 효과적일 것이라 생각했고 시험 직전에 필기를 다시 한 번 노트정리하면 두 번 복습할 수 있을 것이라 생각했기 때문입니다. 물론 필기에 집중하기 위해서 영상을 시청하는 동안 휴대폰이나 노트북 등으로 다른 일을 하지 않도록 노력했습니다. 영상을 여러 번 보는 것도 학습을 위해 필요하다는 생각이 들어서 이해가 되지 않는 부분은 여러 번 돌려 보면서 확인해고자 했습니다. 특히 정조의 화성 축조 과정에서 수원의 위치 부분이 너무 헷갈려서 여러 번 확인하고, 또 인터넷에 검색해 보며 이해하고자 했습니다.","과제 없이 수업이 진행된 점도 도움이 되었던 것 같습니다. 학습 평가 자체는 시험으로 충분하게 확인할 수 있었고, 과제에 대한 부담이 없어 영상 시청 및 필기 자체에 더 집중할 수 있었던 것 같습니다. 스노우보드의 퀴즈 게시판을 활용한 것은 이 수업뿐이었는데, 정해진 시간 안에 문제를 풀이하게 되면서 줌이나 구글 미트 같은 확인 절차 없이도 각자 성실하게 시험을 진행할 수 있어 좋은 방법이라고 생각했던 것 같고, 시험 이전에 보다 긴장감을 갖고 공부할 수 있었던 것 같습니다. 또 소통을 강조하신 수업 방법이 수업 전반에 대한 흥미도를 더 높였던 것 같습니다. 수업 내내 교수님께서 이해하기 어려운 내용이나 질문할 점이 있으면 항상 걱정하지 말고 메일을 보내 달라고 강조하셨었는데, 이런 부분에서 대면수업과 달리 온라인 수업에서는 교수님과의 소통이 이루어지기 어려울 것이라는 편견이 없어졌던 것 같고 또 교수님께 내적 친밀감을 형성하게 되어서 수업을 들을 때마다 좀 더 마음이 편해지고 이해도 전보다 더 빠르게 할 수 있었으면서 역사 과목에 대한 흥미도 더 가질 수 있었던 것 같습니다. 대면 수업 시 수업 내용에 대한 간단한 퀴즈 풀이를 스노우보드를 통해 진행하면 어떨까 하는 생각이 들었습니다. 당일의 학습 내용을 한 번 더 점검해 볼 수 있을 뿐만 아니라 학생이 수업을 정말 집중해서 들었는지 점검할 수 있는 기회가 될 수 있을 것이라 생각하고, 또 학생이 퀴즈가 있다는 것을 안다면 수업을 더 열심히 들을 것이라 생각하기 때문입니다. 이 수업은 대면수업인 경우 필기를 위한 수업 참조 자료가 스노우보드에 올라오는 것으로 알고 있는데, 그 부분은 지속되었으면 좋겠다고 생각했습니다. 수업 자료를 수업 당일 나눠주는 것보다 그 이전에 게시하여 예습할 수 있도록 만들면서, 자료를 가져왔는지 확인하는 과정을 통해서 수업에 대한 성실도를 점검할 수 있기 때문입니다. 또, 대면수업인 경우에도 수업 내용을 녹화해서 게시한다면 시험 대비 및 수업 복습 시에 무척 도움이 될 것이라 생각했습니다. 교수님의 설명 속도에 따라가지 못해 수업을 제대로 듣지 못하는 경우에 영상 속도를 천천히 해 이해할 수 있고, 속도를 빠르게 놓고 재생하는 경우 학습한 내용을 다시 한 번 점검하기에 좋은 방법이 되기 때문입니다. 또한 여러 번 수업 내용을 곱씹으면서 당시에는 이해하지 못했던 내용들을 영상을 보는 동시에 인터넷으로 찾아보거나, 정말 모르겠는 경우에는 정리해서 교수님께 질문드릴 수 있기 때문입니다.
중간고사 기간에 이 수업을 통해 필기와 노트정리가 효율적인 방법이라는 사실을 깨달았고 다른 수업에서도 이 방법을 활용하게 되었습니다. 그 결과 게시되는 영상에 더욱 집중할 수 있었고 시간 활용 면에 있어서 좀 더 효과적으로 학습을 진행해 나갈 수 있었습니다. 또한 올라오는 영상들을 최대한 빨리 확인하고 학습하고자 했기 때문에 다른 수업들에서도 함께 한 번도 빠지지 않을 수 있었고 성실함을 보다 발전시켜 나갈 수 있었던 것 같습니다. 수업 자체가 중간중간에 영상들도 충분히 들어가 있고, 전혀 지루한 내용이 아니어서 그런지 역사라는 과목에 대해서 흥미를 가질 수 있게 되었고, 암기에 대한 공포감이 있었는데 이 수업을 통해 암기가 그렇게 어려운 것이 아니라는 사실을 깨달을 수 있게 되었습니다. 이 깨달음이 다른 수업들에 충분히 확장되어 내용 암기나 과목에 대한 흥미 전반에 긍정적인 방향으로 작용했고, 1학기 동안 공부에 거리감을 느끼기보다 친밀감을 가질 수 있었던 것 같습니다. 수업을 진행하면서 과제가 없었는데, 이 점이 자기주도적으로 계획해서 학습을 진행할 수 있게 만들어 준 가장 큰 긍정적 영향이었다고 생각합니다. 보통 과제가 있는 경우에는 과제에만 집중하게 되기 때문에 스스로 학습을 계획한다기보다는 과제 순서에 맞춰서 타의적으로 따라가게 되는데, 이 수업에서는 수업 내용 이외에는 타의에 의해 진도를 맞출 필요가 없어서 복습 측면에서는 개인적인 학습 계획이 필요했습니다. 따라서 학습 일정도 계획해 보게 되고, 스스로 자신을 채찍질하며 나 자신의 계획성과 성실성 모두를 자의에 의해 점검하게 되었습니다. 이를 통해 다른 수업들에서도 원활하게 학습 계획을 설정할 수 있었고 계획 후 실천을 전보다 더 성공적으로 이뤄낼 수 있게 되었던 것 같습니다.","['과제', '없이', '진행', '점도', '도움', '되었던', '학습', '평가', '자체', '시험', '충분하게', '확인', '있었고', '과제', '부담', '없어', '영상', '시청', '필기', '자체', '집중', '있었던', '스노우보드', '퀴즈', '게시판', '활용', '뿐이었는데', '정해진', '시간', '안', '문제', '풀이', '하게', '되면서', '줌', '구글', '미트', '같은', '확인', '절차', '없이도', '각자', '성실하게', '시험', '진행', '있어', '좋은', '방법', '생각', '했던', '같고', '시험', '이전', '보다', '긴장감', '갖고', '공부', '있었던', '소통', '강조', '하신', '방법', '전반', '흥미', '도를', '높였던', '내내', '이해', '어려운', '질문', '있으면', '항상', '걱정', '하지', '메일', '보내', '달라', '강조', '하셨었는데', '이런', '부분', '대면', '달리', '온라인', '소통', '이루어지기', '어려울', '편견', '없어졌던', '같고', '내적', '친밀', '감', '형성', '하게', '되어서', '들을', '좀', '마음', '편해지고', '이해도', '전보', '빠르게', '있었으면서', '역사', '과목', '흥미', '가질', '있었던', '대면', '시', '간단한', '퀴즈', '풀이', '스노우보드', '진행', '하면', '어떨까', '생각', '들었습니다', '당일', '학습', '점검', '있을', '뿐', '아니라', '정말', '집중', '들었는지', '점검', '기회', '있을', '생각', '퀴즈', '있다는', '안다면', '열심히', '들을', '생각', '때문', '대면', '필기', '참조', '자료', '스노우보드', '올라오는', '알', '부분', '지속', '되었으면', '좋겠다고', '생각', '자료', '당일', '나눠주는', '이전', '게시', '예습', '있도록', '만들면서', '자료', '가져왔는지', '확인', '과정', '성실', '도를', '점검', '있기', '때문', '대면', '녹화', '게시', '한다면', '시험', '대비', '복습', '시', '무척', '도움', '생각', '설명', '속도', '따라가지', '제대로', '듣지', '영상', '속도', '천천히', '이해', '있고', '속도', '빠르게', '놓고', '재생', '학습', '다시', '점검', '하기에', '좋은', '방법', '되기', '때문', '여러', '곱씹으면서', '당시', '이해', '하지', '했던', '영상', '보는', '동시', '인터넷', '찾아보거나', '정말', '모르겠는', '정리', '질문', '드릴', '있기', '때문', '중간고사', '기간', '필기', '노트', '정리', '효율', '방법', '사실', '깨', '달았고', '다른', '방법', '활용', '하게', '결과', '게시', '되는', '영상', '더욱', '집중', '있었고', '시간', '활용', '면', '있어서', '좀', '효과', '학습', '진행', '나갈', '있었습니다', '올라오는', '영상', '최대한', '빨리', '확인', '학습', '하고자', '했기', '때문', '다른', '함께', '빠지지', '않을', '있었고', '성실함을', '보다', '발전', '시켜', '나갈', '있었던', '자체', '중간', '중간', '영상', '충분히', '들어가', '있고', '전혀', '지루한', '아니어서', '그런지', '역사', '과목', '대해', '흥미', '가질', '있게', '되었고', '암기', '공포', '감', '있었는데', '암기', '그렇게', '어려운', '아니라는', '사실', '깨달', '있게', '깨달음', '다른', '충분히', '확장', '되어', '암기', '과목', '흥미', '전반', '긍정', '방향', '작용', '했고', '학기', '동안', '공부', '거리', '감', '느끼', '기보', '친밀', '감', '가질', '있었던', '진행', '하면서', '과제', '없었는데', '자기', '주도', '학습', '진행', '있게', '만들어', '준', '가장', '큰', '긍정', '영향', '이었다고', '생각', '보통', '과제', '과제', '집중', '하게', '되기', '때문', '스스로', '학습', '다기', '과제', '순서', '맞춰서', '의적', '따라가게', '되는데', '이외', '타의', '의해', '진도', '맞출', '필요', '없어서', '복습', '측면', '개인', '학습', '필요했습니다', '따라서', '학습', '일정', '보게', '되고', '스스로', '자신', '채찍', '질하며', '자신', '계획성', '성실', '자의', '의해', '점검', '하게', '다른', '원활하게', '학습', '설정', '있었고', '실천', '전보', '성공', '이뤄', '낼', '있게', '되었던']",0.5368826268212562,0.08151462619806764,0.3080251217439614,positive
