student,structure,effort,evaluation,tokens,pos,neut,neg,sentiment
88,"코로나 상황으로 인해 매 수업은 ‘줌’이라는 프로그램을 활용하여 진행되었습니다. 교수님께서 지정해주신 교재를 미리 읽은 후, 학생들이 번갈아 가며 요약을 하고, 토의 주제를 미리 준비해오는 방식이었습니다. 요약본과 토의주제의 경우, 미리 교수님의 피드백을 받은 뒤 스노보드에 업로드했습니다. 수업 날, 요약 발표를 맡은 학생은 학생들과 교수님 앞에서 요약본에 관해 설명한 뒤, 토의 주제를 말합니다. 토의 주제가 정해지면 ‘줌’의 ‘소회의실’ 기능을 이용하여 조 사람들과 자유롭게 토의를 하는 식으로 수업이 진행되었습니다. 이번 수업은 중간고사와 기말고사를 보지 않고, 기말에 최종보고서를 제출하는 방식으로 진행됐습니다. 때문에, 교재 활동이 끝난 뒤 미리 최종보고서에 관한 계획안을 작성하고 이에 대한 발표와 교수님의 피드백을 들었던 수업도 있었습니다. 이 때, 교수님의 의견을 듣고 보고서 주제를 바꾸거나 수정하여 다시 계획안을 작성했습니다. 피드백을 받은 이후에는, 하나의 토의 주제를 정하여 수업 인원 전체가 함께 토의를 하는 시간을 가졌습니다. 이번 학기의 토의 주제를 ‘트렌스젠더의 여대 입학’으로 정하여 자유롭게 토의하였습니다. 인원은 반으로 나누어 총 2개의 조로 각각 토의를 진행하였고, 토의가 진행됨에 따라 조끼리 조사를 하고 찬/반을 나누면서 다양한 의견을 서로 얘기하는 시간을 가졌습니다. 더 나아가, 토의가 어떻게 진행되었는지에 관한 토의노트를 작성하며 다른 사람들의 의견과 최종적인 본인의 의견을 정리할 수 있었습니다.","수업 초반에는 서로 요약본을 나누어 읽고 토의하는 형식이었습니다. 제가 발표자였을 때에는 교재를 꼼꼼히 읽고, 요약본을 제시간에 제출한 다음 교수님의 피드백을 받아 수정했습니다. 제가 발표자가 아니었을 때에는, 교재를 미리 훑어보거나 시간이 없을 때에는 요약본을 훑어본 뒤 토의 주제에 관해 미리 생각을 했습니다. 최종보고서 계획안 공개 피드백의 경우 제시간에 제출을 하려 노력했고, 어떻게 발표할지를 구상하였습니다. 이후 받은 피드백을 바탕으로 계획안, 중간보고서 그리고 최종보고서를 작성했습니다. 전체 토의의 경우, 조원들과 함께 토의 주제의 정의, 주제와 관련된 해외 사례 등을 조사하여 정리했습니다. 이후에는 찬/반을 나누어 서로의 의견을 적극적으로 나누려고 노력했습니다. ","수업 시간에 서로 ‘토의’를 했던 것이 저에게는 많은 도움이 되었습니다. 말하는 것에 익숙치 않고 자기주관이 뚜렷하지 않아 토의를 하기 전에는 두려운 마음이 컸습니다. 하지만 토의를 지속적으로 하다보니 제 주관을 명확하게 펼칠 수 있었고, 다른 학생들의 의견도 들으면서 생각의 차이를 느끼거나, 제 의견 또는 근거에서의 오류를 발견할 수 있었습니다. 그리고 최종보고서를 어떻게 써야할지도 어려웠고, 계획서 또는 중간보고서를 어떻게 써야할지 막막했습니다. 하지만 수업 중간에 교수님께서 공개적으로 피드백을 해주시고 계획서의 경우, 피드백 이후 쓴 것을 점수에 들어가게 하여 배려해주신 점이 인상깊었습니다. 조금 아쉬웠던 점은 토의와 교수님의 피드백 등의 활동들이 대면으로 이루어졌으면 좀 더 실감나게 토의를 하거나, 최종보고서 혹은 전체 토의에도 큰 영향을 줬을 것 같은 점입니다. 이 수업을 통해, 저만의 자기주관을 세울 수 있었습니다. 그리고 제 주장을 좀 더 자신있게 펼칠 수 있었습니다. 이전에는 다른 사람들의 말에 잘 휘둘리곤 했는데 다양한 토의들을 통해 제 의견을 펼치면, 동의해주는 사람들을 보면서 자신감이 붙었습니다. 이를 기반으로, 앞으로 제 주장을 자신있게 펼칠 수 있을 것 같습니다. 더 나아가, 발표를 할 때의 두려움을 쫓을 수 있어 좋았습니다.","['시간', '서로', '토의', '했던', '많은', '도움', '말', '익숙', '치', '않고', '자기', '주관', '뚜렷하지', '않아', '토의', '두려운', '마음', '컸습니다', '토의', '지속', '하다', '보니', '주관', '명확하게', '펼칠', '있었고', '다른', '의견', '들으면서', '생각', '차이', '느끼거나', '의견', '또는', '근거', '오류', '발견', '있었습니다', '최종', '보고서', '어떻게', '써야', '할지도', '어려웠고', '또는', '중간', '보고서', '어떻게', '써야', '할지', '막막했습니다', '중간', '공개', '피드백', '해주시', '피드백', '쓴', '점수', '들어가게', '배려', '해주신', '인상', '깊었습니다', '조금', '아쉬웠던', '토의', '피드백', '활동', '대면', '이루어졌으면', '좀', '실감', '나게', '토의', '거나', '최종', '보고서', '혹은', '전체', '토의', '큰', '영향', '줬을', '같은', '자기', '주관', '세울', '있었습니다', '주장', '좀', '자신있게', '펼칠', '있었습니다', '이전', '다른', '사람', '말', '잘', '휘', '둘리', '곤', '했는데', '다양한', '토의', '의견', '펼치면', '동의', '해주는', '사람', '보면서', '자신감', '붙었습니다', '앞', '주장', '자신있게', '펼칠', '있을', '나아가', '두려움', '쫓을', '있어', '좋았습니다']",0.6400401669999999,0.02796628084905661,0.22344132616981133,positive
89,수업은 일단 스노보드로 진행이 되었다. 실시간 줌 수업이 아닌 녹화한 영상이었다.  교수님께서 중간중간에 유튜브 링크만 삽입하는 것이 아닌 유튜브 영상을 가져오셔서 수업 때처럼 시청하며 분석하였다. ," 이번 학기는 개개인이 시간을 어떻게 활용하냐에 따라 많이 달라진 것 같다. 대면과 비대면 수업이 교차하기도 하며, 실시간 줌 수업과 스노보드 녹화 방송도 교차되었기 때문이다. 실시간 수업의 경우는 어쩔 수 없이 그 시간에 들어야 하지만, 녹화 방송 수업이 많은 경우, 그 시간을 어떻게 쓰는지, 공부를 어떻게 하는지, 시간을 잘 짜는 것이 중요하다고 느꼈다. 그래서 탁상 달력에 세세한 부분까지 스케쥴을 정리하였다. 과제를 빼먹지 않기 위해 수업이 끝나자마자 날짜를 나누어 과제를 정리하였다. 주말에는 그 주에 있을 수업을 시작 시간과 요일에 나누어 적었고, 하나하나 체크를 해가면서 모든 과제를 해결하였다. 평소 어려워하던 수업이어서 악보 분석이나 유튜브를 많이 참고하였고, 필기를 놓친 부분이 있다면 강의를 멈추어 정리를 한 후에 다시 들었다. 지난 학기에 현대음악 분석 II를 먼저 들었었는데, 대면 수업일 때는 원래 흥미가 없던 부분이라 집중도 안되었고, 시험에 엄청난 노력을 하진 않았던 것 같다. 하지만 이번에는 집에서 듣는 만큼 더 노력해보자라고 생각하며 최선을 다해 공부를 했다고 말할 수 있다. 기말고사에서 많은 점수가 들어가는 만큼 정말 악보에 나오는 부분들을 다 암기하였다. 또한 내가 최대한으로 집중할 수 있는 시간을 골라 그 시간에 규칙적으로 들으려고 노력하였다. ","이 수업만큼은 정말 교수님꼐서 준비를 엄청하셨다는 것을 느끼게 되었다. 실시간 수업의 경우 네트워크 문제나 대면 수업과 연속으로 수업인 경우 들을 환경이 좋지 않아 힘든 경우가 많았는데, 스노보드를 활용하여 녹화 방송인 점이 좋았다. 매주 간단한 과제와 분석 과제가 주어졌지만, 통학 시간이 줄어들어서 과제하는데 무리는 없었다. 이 수업이 특히 좋았던 부분은 수업 시간에만 들을 수 있었다가, 수업 시작하는 시간부터 그 날까지 들을 수 있게 수정이 되었다가, 아예 그 날 오전 00시부터 들을 수 있게 바꿔주셨다. 피드백을 굉장히 빠르게 수렴하여 주셔서 요청 사항은 바로 바꿔주시며 같이 수업을 해 나갔다. 뒤에 연속적으로 다른 수업이 대면으로 수업이어서 수업 시작하는 시간에 듣기 힘들었는데, 피드백을 반영하여 주셔서 학교에 가기 전 오전에 들을 수 있게 해 주셨다. 심지어 수업은 어떤지 궁금하시다며 전화를 주시기도 하였고, 메일로 문의 사항이나 수업에 관련된 질문을 남기면 메일로 답을 주시기도 하고, 전화로 설명을 해주시기도 하셨다. 비대면 수업이 나에게는 더 도움이 되었다. 녹화 방송인 이 수업은 내가 놓친 부분을 다시 볼 수도 있고, 필기하기 위해 강의를 멈출 수도 있어서 많은 도움이 되었다. 내가 원하는 시간에 들을 수 있는 점, 강의를 멈출 수 있는 점이 가장 도움이 되었던 점이라 생각한다. 내가 원하는 시간에 원하는 장소에서 들으니 집중도 더 잘 되었고, 일정에 맞게 계획하는데도 도움이 되었다. 정말 대면 수업을 할 수밖에 없는 수업들만 대면 수업으로 진행하고, 비대면 수업이 가능하다면 비대면 수업만 진행해주셨으면 좋겠다. 확진자와 동선이 겹쳐 수업에 나가지 못하였는데, 학교 측에서는 유고결석이 되지만, 교수님께서는 다르게 받아들이시는 경우도 있어 이 점도 확실히 해주셨으면 좋겠다.피치 못한 수업인 경우 조별로 시간대를 나누어 학교에서 대면 수업을 진행하였으면 
좋겠다. 통학에 굉장히 스트레스를 받으며 힘들다 느껴서, 개인적으로는 대면 수업보다 비대면 수업이 더 잘 맞았다. 그래서 비대면일 때 학업에 더 집중할 수 있게 되었다. 비대면이 되면서 달력에 정리를 하며 듣다 보니, 계획적인 사람으로 바뀌었다. 지난 학기에는 크게 항목을 나누어 정리를 하였지만, 이번에는 일정을 빠뜨리지 않기 위해 세부적인 부분들도 정리를 하였다. 이렇게 몇 주를 지내보니 계획하고 그 일을 해결 해 나가는 것에 쾌감을 느끼기 시작하며, 흥미가 생겼다. 의도치 않게 계획적인 사람이 되어가면서 시험도 계획을 세워 하다보니 성적에도 좋은 결과가 나왔다. 등수도 보통 중간 등수였지만, 이번에 무려 4등이나 하게 되면서 역대급으로 높은 등수를 받았다. 높은 성적과 높은 등수를 받다 보니 다음 학기에도 욕심이 생겨 계획적인 삶을 계속 유지해보려고 한다. 계절학기도 처음 들어보고 있는데, 이 수업에서 계획적으로 사는 삶을 유지하다 보니 두 과목을 듣고 아르바이트까지 병행하여도 아직까지 문제가 없다.","['정말', '꼐', '준비', '엄청', '하셨다는', '느끼게', '되었다', '실시간', '네트워크', '문제', '대면', '연속', '들을', '환경', '좋지', '않아', '힘든', '많았는데', '스노보드', '활용', '녹화', '방송인', '좋았다', '매주', '간단한', '과제', '분석', '과제', '주어졌지만', '통학', '시간', '줄어들어서', '과제', '하는데', '무리는', '없었다', '특히', '좋았던', '부분', '시간', '들을', '있었다가', '시작', '시간', '들을', '있게', '수정', '되었다가', '아예', '들을', '있게', '바꿔주셨다', '피드백', '굉장히', '빠르게', '수렴', '주셔서', '요청', '사항', '바로', '바꿔주시며', '같이', '나갔다', '뒤', '연속', '다른', '대면', '시작', '시간', '듣기', '힘들었는데', '피드백', '반영', '주셔서', '학교', '가기', '들을', '있게', '주셨다', '심지어', '어떤지', '궁금하시다며', '전화', '주시', '기도', '하였고', '메일', '문의', '사항', '질문', '남기면', '메일', '답', '주시', '기도', '전화', '설명', '해주시', '기도', '하셨다', '비대', '도움', '되었다', '녹화', '방송인', '내', '놓친', '부분', '다시', '수도', '있고', '필기', '멈출', '수도', '있어서', '많은', '도움', '되었다', '내', '원하는', '시간', '들을', '멈출', '가장', '도움', '되었던', '생각', '내', '원하는', '시간', '원하는', '장소', '들으니', '집중', '잘', '되었고', '일정', '맞게', '하는데도', '도움', '되었다', '정말', '대면', '대면', '진행', '비대', '가능하다면', '비대', '진행', '해주셨으면', '좋겠다', '확', '진자', '동선', '겹', '쳐', '나가지', '하였는데', '학교', '측', '유고', '결석', '되지만', '다르게', '받아들이시는', '있어', '점도', '확실히', '해주셨으면', '좋겠다', '피치', '못', '별로', '시간대', '나누어', '학교', '대면', '진행', '하였으면', '좋겠다', '통학', '굉장히', '스트레스', '받으며', '힘들다', '느껴서', '개인', '대면', '비대', '잘', '맞았다', '그래서', '비대', '학업', '집중', '있게', '되었다', '비', '대면', '되면서', '달력', '정리', '듣다', '보니', '사람', '바뀌었다', '지난', '학기', '항목', '나누어', '정리', '하였지만', '일정', '빠뜨리지', '않기', '세부', '부분', '정리', '하였다', '이렇게', '지내', '보니', '해결', '나가는', '쾌감', '느끼기', '시작', '흥미', '생겼다', '의도', '치', '않게', '사람', '되어가면서', '시험', '세워', '하다', '보니', '성적', '좋은', '결과', '나왔다', '등수', '보통', '중간', '등수', '였지만', '무려', '하게', '되면서', '역대', '높은', '등수', '받았다', '높은', '성적', '높은', '등수', '받다', '보니', '학기', '욕심', '생겨', '삶', '계속', '유지', '해보려고', '계절', '학기', '처음', '보고', '사는', '삶', '유지', '하다', '보니', '두', '과목', '듣고', '아르바이트', '병행', '하여도', '아직', '문제', '없다']",0.48424783238759683,0.05488400488372092,0.36055397393798444,positive
90,"공학기초물리1은 중반부터 유튜브 실시간 강의로 진행되었는데, 강의를 들으면서 교수님의 질문에 답을 할 수 있어서 수업에 집중하기 좋았습니다. 질문 게시판이 활발하게 운영되었다는 점도 학습에 큰 도움이 됐습니다. 사실 질문 게시판만큼 효과적인 커뮤니케이션 경로는 없다고 생각합니다. 학생이 교수님과 소통을 하는 방법에는 메일이나 문자도 있지만, 이 방법들은 1:1로만 가능하기 때문에 같은 수업을 듣는 학우들과 답변을 공유하기 어렵다는 단점이 있었습니다. 질문 게시판이 활성화되면서 다른 친구들이 어떤 부분을 어려워하는지 알 수 있었고 교수님이 어떻게 답글을 남기셨는지도 읽어보면서 관련 개념을 정리할 수 있었습니다. 공학기초물리1은 피피티로 수업이 진행되었는데, 수업의 질이 낮다는 생각은 들지 않았습니다. 오히려 교수님께서 더 공들여 자료를 준비하고 시행착오를 거쳐서 강의의 질을 더 향상시키고 있다는 것을 체감할 수 있었습니다. 음질도 강의 회차를 거듭할 때마다 조금씩 깨끗해졌습니다.
시험에 응시하고 답안을 제출하는 방식도 간결하고 편리했습니다. 기간 안에 문제를 풀고 답안은 사진을 찍어 메일로 제출하는 방식이었습니다. 많은 학생들이 접속하는 스노우보드는 접속량으로 인해 오류가 발생하는 사례가 있었는데, 교수님 메일로 답안을 제출하는 방식은 학교 사이트에 접속해서 제출하는 것보다 이러한 우려가 덜하다는 이점이 있었습니다. 권우성 교수님은 코로나 감염이 확산되자 기말고사를 치르는 방식을 학생들의 투표로 결정하셨습니다.",없음,"제 경우에는 전공과목 전부가 비대면 수업이었는데, 교수님과 눈을 맞추며 수업을 들을 수 없어서 수업에 몰입하기 어려웠습니다.  강의 진행에 학생들의 의견이 민주적으로 반영되고 있다는 느낌이 들어서 만족스러웠습니다. 온라인 수업의 한계는 학생들이 수동적인 태도를 갖게 된다는 점입니다. 한 학기 동안 수업을 들으면서 능동적으로 의견을 내거나, 향상되었으면 좋겠다고 생각하는 부분에서 이의를 제기하기가 힘들었습니다. 수업에 ‘참여’하고 있다기보다 수업을 ‘듣고’있다는 기분이 들었기 때문입니다. 수업 방식에 학생들의 의견을 반영하는 것은 학생들 개개인에게 주체적인 의사 표현을 할 기회를 마련해주는 중요한 과정입니다. 모든 교수님들께서 강의(특히 온라인 강의)를 진행하실 때 학생들의 의견을 묻는 장을 작게나마 만들어 주신다면 강의를 듣는 학생들이 더 능동적으로 학습을 주도하며 성장할 수 있을 것이라고 생각합니다.","['전공', '과목', '전부', '비대', '이었는데', '눈', '맞추며', '들을', '없어서', '몰입', '어려웠습니다', '진행', '의견', '민주', '반영', '되고', '있다는', '느낌', '들어서', '만족스러웠습니다', '온라인', '한계', '수동', '태도', '갖게', '된다는', '학기', '동안', '들으면서', '능동', '의견', '거나', '향상', '되었으면', '좋겠다고', '생각', '부분', '이의', '제기', '하기가', '힘들었습니다', '참여', '다기', '듣고', '있다는', '기분', '들었기', '때문', '방식', '의견', '반영', '개개인', '주체', '의사', '표현', '기회', '마련', '해주는', '중요한', '과정', '모든', '들께서', '특히', '온라인', '진행', '하실', '의견', '묻는', '장', '작게나마', '만들어', '주신다면', '듣는', '능동', '학습', '주도하며', '성장할', '있을', '생각']",0.5537280701578947,0.07337092731578947,0.29755639097368425,positive
